{
  "schema_version": 1,
  "assignment_id": "assign-local-codex-1-codex-cli-example",
  "created_at": "2026-06-24T00:00:00.000+08:00",
  "runtime_id": "codex-cli",
  "selection_kind": "runtime",
  "capability": "",
  "worker_id": "local-codex-1",
  "status": "ASSIGNED",
  "dry_run": true,
  "governance": {
    "risk": "MEDIUM",
    "execution_mode": "local_repo_execute",
    "proposal_required": false,
    "human_approval_required": false
  },
  "blocked_reasons": []
}
